{
  "user_id": "demo-nus-business-y3",
  "jd_text": "Grab Singapore Product Analyst role focused on product metrics, user behaviour analysis, experimentation, stakeholder communication, and data-informed product recommendations.",
  "version": 1,
  "created_at": "2026-05-20T00:00:00Z",
  "nodes": [
    {
      "requirement": {
        "skill": "Product metrics analysis",
        "importance": 0.95,
        "category": "product_analytics",
        "confidence": 0.92,
        "sources": [
          {
            "claim": "Grab product roles require using data to improve customer and partner experiences.",
            "source_url": "https://www.grab.com/sg/careers/",
            "published_at": "2026-03-15T00:00:00Z",
            "retrieved_at": "2026-05-20T00:00:00Z",
            "confidence": 0.82,
            "source_type": "job_post",
            "uncertainty_note": null
          }
        ]
      },
      "status": "matched",
      "evidence": [
        {
          "type": "module",
          "title": "BT2102 Data Management and Visualisation",
          "skills_proven": ["data analysis", "metric design", "dashboarding"],
          "strength": "strong"
        },
        {
          "type": "internship",
          "title": "Product Analytics Intern, Singapore fintech startup",
          "skills_proven": ["funnel analysis", "KPI tracking", "product recommendations"],
          "strength": "strong"
        }
      ],
      "gap_action": null,
      "resume_bullet": "Analysed onboarding funnel metrics during a fintech internship and translated insights into product recommendations for growth and retention.",
      "sources": [
        {
          "claim": "BT2102 supports data management and visualisation evidence for product metrics work.",
          "source_url": "https://nusmods.com/courses/BT2102/data-management-and-visualisation",
          "published_at": "2025-08-01T00:00:00Z",
          "retrieved_at": "2026-05-20T00:00:00Z",
          "confidence": 0.86,
          "source_type": "course_catalogue",
          "uncertainty_note": null
        }
      ]
    },
    {
      "requirement": {
        "skill": "SQL and data pipeline fluency",
        "importance": 0.88,
        "category": "technical",
        "confidence": 0.9,
        "sources": [
          {
            "claim": "Product analyst roles commonly require extracting and analysing structured product data.",
            "source_url": "https://www.onetonline.org/link/summary/15-2051.01",
            "published_at": "2025-11-01T00:00:00Z",
            "retrieved_at": "2026-05-20T00:00:00Z",
            "confidence": 0.78,
            "source_type": "industry_report",
            "uncertainty_note": null
          }
        ]
      },
      "status": "matched",
      "evidence": [
        {
          "type": "module",
          "title": "BT3103 Application Systems Development for Business Analytics",
          "skills_proven": ["business analytics systems", "data workflows", "SQL-backed applications"],
          "strength": "strong"
        }
      ],
      "gap_action": null,
      "resume_bullet": "Built analytics-system coursework that connected structured data workflows to business decision use cases.",
      "sources": [
        {
          "claim": "BT3103 provides business analytics systems evidence relevant to SQL-backed product data workflows.",
          "source_url": "https://nusmods.com/courses/BT3103/application-systems-development-for-business-analytics",
          "published_at": "2025-08-01T00:00:00Z",
          "retrieved_at": "2026-05-20T00:00:00Z",
          "confidence": 0.84,
          "source_type": "course_catalogue",
          "uncertainty_note": null
        }
      ]
    },
    {
      "requirement": {
        "skill": "Cross-functional stakeholder communication",
        "importance": 0.82,
        "category": "communication",
        "confidence": 0.87,
        "sources": [
          {
            "claim": "Grab product work involves collaborating across business, operations, engineering, and regional teams.",
            "source_url": "https://www.grab.com/sg/careers/life-at-grab/",
            "published_at": "2026-01-20T00:00:00Z",
            "retrieved_at": "2026-05-20T00:00:00Z",
            "confidence": 0.77,
            "source_type": "job_post",
            "uncertainty_note": null
          }
        ]
      },
      "status": "matched",
      "evidence": [
        {
          "type": "module",
          "title": "IS1128 Information Systems Leadership and Communication",
          "skills_proven": ["stakeholder communication", "systems thinking", "team collaboration"],
          "strength": "strong"
        },
        {
          "type": "internship",
          "title": "Weekly product review presentations at fintech startup",
          "skills_proven": ["executive communication", "insight synthesis"],
          "strength": "strong"
        }
      ],
      "gap_action": null,
      "resume_bullet": "Presented weekly product insights to fintech stakeholders, connecting user behaviour signals with implementation priorities.",
      "sources": [
        {
          "claim": "IS1128 supports evidence of information systems communication and teamwork.",
          "source_url": "https://nusmods.com/courses/IS1128/information-systems-leadership-and-communication",
          "published_at": "2025-08-01T00:00:00Z",
          "retrieved_at": "2026-05-20T00:00:00Z",
          "confidence": 0.8,
          "source_type": "course_catalogue",
          "uncertainty_note": null
        }
      ]
    },
    {
      "requirement": {
        "skill": "Experiment design and A/B test interpretation",
        "importance": 0.78,
        "category": "experimentation",
        "confidence": 0.81,
        "sources": [
          {
            "claim": "Modern product analysts are expected to interpret experiments and separate signal from noise.",
            "source_url": "https://www.mindtheproduct.com/product-analytics/",
            "published_at": "2025-10-10T00:00:00Z",
            "retrieved_at": "2026-05-20T00:00:00Z",
            "confidence": 0.72,
            "source_type": "industry_report",
            "uncertainty_note": null
          }
        ]
      },
      "status": "weak",
      "evidence": [
        {
          "type": "internship",
          "title": "Fintech onboarding funnel analysis",
          "skills_proven": ["conversion analysis", "hypothesis generation"],
          "strength": "weak"
        }
      ],
      "gap_action": "Complete Google Advanced Data Analytics Professional Certificate experiment and regression modules, then publish a small A/B test case study.",
      "resume_bullet": "Investigated onboarding conversion drops and proposed experiment hypotheses for fintech product flows.",
      "sources": [
        {
          "claim": "Existing internship evidence shows funnel analysis but not full A/B test ownership.",
          "source_url": "https://grow.google/certificates/advanced-data-analytics/",
          "published_at": "2026-02-01T00:00:00Z",
          "retrieved_at": "2026-05-20T00:00:00Z",
          "confidence": 0.7,
          "source_type": "industry_report",
          "uncertainty_note": null
        }
      ]
    },
    {
      "requirement": {
        "skill": "Product storytelling with visual evidence",
        "importance": 0.75,
        "category": "communication",
        "confidence": 0.79,
        "sources": [
          {
            "claim": "Analysts are expected to turn analysis into clear recommendations for product decision-makers.",
            "source_url": "https://www.productplan.com/glossary/product-analytics/",
            "published_at": "2025-09-18T00:00:00Z",
            "retrieved_at": "2026-05-20T00:00:00Z",
            "confidence": 0.73,
            "source_type": "industry_report",
            "uncertainty_note": null
          }
        ]
      },
      "status": "weak",
      "evidence": [
        {
          "type": "module",
          "title": "BT2102 Data Management and Visualisation",
          "skills_proven": ["dashboarding", "visualisation"],
          "strength": "weak"
        }
      ],
      "gap_action": "Turn the BT2102 dashboard into a public portfolio case study with a decision narrative and measurable product recommendation.",
      "resume_bullet": "Designed analytics dashboards and converted data patterns into product recommendation narratives.",
      "sources": [
        {
          "claim": "BT2102 provides visualisation evidence, but the profile needs a portfolio artifact to prove storytelling quality.",
          "source_url": "https://nusmods.com/courses/BT2102/data-management-and-visualisation",
          "published_at": "2025-08-01T00:00:00Z",
          "retrieved_at": "2026-05-20T00:00:00Z",
          "confidence": 0.76,
          "source_type": "course_catalogue",
          "uncertainty_note": null
        }
      ]
    },
    {
      "requirement": {
        "skill": "Causal inference for product decisions",
        "importance": 0.69,
        "category": "analytics",
        "confidence": 0.74,
        "sources": [
          {
            "claim": "Product analytics decisions benefit from causal reasoning when observational data may be biased.",
            "source_url": "https://developers.google.com/machine-learning/crash-course/causal-inference",
            "published_at": "2025-07-15T00:00:00Z",
            "retrieved_at": "2026-05-20T00:00:00Z",
            "confidence": 0.71,
            "source_type": "industry_report",
            "uncertainty_note": null
          }
        ]
      },
      "status": "missing",
      "evidence": null,
      "gap_action": "Complete the Google Advanced Data Analytics Professional Certificate, then publish a portfolio analysis comparing correlation, confounding, and treatment effects.",
      "resume_bullet": null,
      "sources": [
        {